{
  "$schema": "../../schema/approach-year.schema.json",
  "format": 1,
  "title": "12. třída (lyceum)",
  "epochs": [
    {
      "id": "fyzika",
      "title": "Fyzika",
      "emoji": "🔭",
      "month": "září",
      "about": [
        "Epocha fyziky. Plán ji podrobně nerozepisuje; procvičit se hodí fyzika 3. ročníku SŠ."
      ],
      "topics": [
        "s3/fyzika/geometricka-optika",
        "s3/fyzika/vlnova-optika",
        "s3/fyzika/kvantova-fyzika",
        "s3/fyzika/jaderna-fyzika"
      ]
    },
    {
      "id": "chemie",
      "title": "Chemie",
      "emoji": "⚗️",
      "month": "říjen",
      "about": [
        "Epocha chemie. Plán ji podrobně nerozepisuje; procvičit se hodí organická chemie a biochemie."
      ],
      "topics": [
        "s3/chemie/zaklady-organicke",
        "s3/chemie/sacharidy",
        "s3/chemie/lipidy",
        "s3/chemie/bilkoviny-enzymy"
      ]
    },
    {
      "id": "evropa-a-cesko",
      "title": "Evropa a Česká republika",
      "emoji": "🗺️",
      "month": "listopad",
      "about": [
        "Evropské regiony a postavení Evropy ve světě. Česko: poloha, přírodní podmínky, hospodářství, obyvatelstvo a sídla, kraje, národnosti, euroregiony a místo v Evropě."
      ],
      "topics": [
        "s3/zemepis/evropa-region",
        "s3/zemepis/cesko-v-regionu",
        "z9/zemepis/cr-obyvatelstvo",
        "z9/zemepis/cr-hospodarstvi",
        "z9/zemepis/cr-kraje"
      ]
    },
    {
      "id": "posloupnosti-a-rady",
      "title": "Posloupnosti a řady",
      "emoji": "♾️",
      "month": "prosinec",
      "about": [
        "Posloupnosti s nekonečně mnoha členy, aritmetická a geometrická posloupnost, součet geometrické řady (Achilles a želva) a limita posloupnosti."
      ],
      "topics": [
        "s3/matematika/aritmeticka-posloupnost",
        "s3/matematika/geometricka-posloupnost",
        "s4/matematika/limita"
      ]
    },
    {
      "id": "management-a-marketing",
      "title": "Management a marketing",
      "emoji": "📈",
      "month": "leden",
      "about": [
        "Osobnosti a dějiny managementu, funkce řízení a organizační struktury, Maslowova pyramida potřeb, marketing: průzkum trhu, produkt, cena, distribuce a propagace."
      ],
      "topics": [
        "s3/zsv/trh-nabidka-poptavka",
        "s1/zsv/motivace-emoce-stres"
      ]
    },
    {
      "id": "socialni-praktikum",
      "title": "Sociální praktikum",
      "emoji": "🤝",
      "month": "únor",
      "about": [
        "Praktikum v sociálním nebo zdravotním zařízení. Je to praxe, ne látka k procvičování."
      ],
      "topics": []
    },
    {
      "id": "faust",
      "title": "Faust",
      "emoji": "📕",
      "month": "březen",
      "about": [
        "Faustovský příběh a mýtus, Goethův život a jeho Faust, otázky poznání, dobra a zla, závislosti a svobody, pozdější zpracování."
      ],
      "topics": [
        "s3/literatura/faust",
        "s2/literatura/preromantismus",
        "s2/literatura/klasicismus"
      ]
    },
    {
      "id": "novovek",
      "title": "Novověk až první světová válka",
      "emoji": "🌍",
      "month": "duben–květen",
      "about": [
        "Humanismus, kolonialismus, víra a třicetiletá válka, vynálezy a obchod, předvečer první světové války a válka sama."
      ],
      "topics": [
        "s2/dejepis/objevy-renesance-reformace",
        "s2/dejepis/tricetileta-valka",
        "s3/dejepis/prumyslova-revoluce",
        "s3/dejepis/sjednoceni-imperialismus",
        "s3/dejepis/prvni-svetova-valka"
      ]
    },
    {
      "id": "dejiny-architektury",
      "title": "Dějiny architektury",
      "emoji": "🏛️",
      "month": "květen–červen",
      "about": [
        "Renesance, baroko a klasicismus, secese a art deco, architektura válečných let a moderna; jak formy staveb souvisí se společností."
      ],
      "topics": []
    },
    {
      "id": "botanika-zoologie-ekologie",
      "title": "Botanika, zoologie a ekologie",
      "emoji": "🌿",
      "month": "červen",
      "about": [
        "Systém a vývoj rostlin, fotosyntéza, obratlovci a savci, ekologické faktory a potravní řetězce."
      ],
      "topics": [
        "s1/biologie/system-rostlin",
        "s1/biologie/fyziologie-rostlin",
        "s2/biologie/ostnokozci-ryby",
        "s2/biologie/obojzivelnici-plazi",
        "s2/biologie/ptaci",
        "s2/biologie/savci",
        "s3/biologie/ekologie"
      ]
    }
  ],
  "ongoing": [
    {
      "id": "matematika",
      "title": "Matematika",
      "emoji": "📐",
      "about": [
        "Blok matematiky: funkce a jejich průběh, limita a derivace, množiny a pravděpodobnost."
      ],
      "topics": [
        "s2/matematika/funkce-vlastnosti",
        "s4/matematika/limita",
        "s4/matematika/derivace",
        "s4/matematika/prubeh-funkce",
        "s1/matematika/mnoziny",
        "s4/matematika/pravdepodobnost"
      ]
    },
    {
      "id": "cestina",
      "title": "Český jazyk a literatura",
      "emoji": "📗",
      "about": [
        "Světová literatura 18. a 19. století, národní obrození, romantismus a realismus, moderna, literatura 1. poloviny 20. století, funkční styly."
      ],
      "topics": [
        "s2/literatura/osvicenstvi",
        "s2/literatura/narodni-obrozeni-pocatky",
        "s2/literatura/narodni-obrozeni-vrchol",
        "s2/literatura/cesky-romantismus",
        "s2/literatura/cesky-realismus",
        "s3/literatura/ceska-moderna",
        "s3/literatura/avantgarda",
        "s1/cestina/komunikace-a-styly"
      ]
    },
    {
      "id": "anglictina",
      "title": "Angličtina",
      "emoji": "🇬🇧",
      "about": [
        "Cestování, nakupování a finance, zdraví, umění a povolání, literatura a zločin, vzdělávání. Modální slovesa pro dedukci, have something done, nepřímá řeč, všechny podmínkové věty."
      ],
      "topics": [
        "s3/anglictina/modals-deduction-present",
        "s3/anglictina/modals-deduction-past",
        "s3/anglictina/causative-have-get",
        "s3/anglictina/reported-questions-commands",
        "s3/anglictina/mixed-conditionals"
      ]
    }
  ]
}
