{
  "$schema": "../../schema/approach-year.schema.json",
  "format": 1,
  "title": "8. třída",
  "epochs": [
    {
      "id": "amerika",
      "title": "Amerika",
      "emoji": "🌎",
      "month": "září",
      "about": [
        "Krajiny Severní a Jižní Ameriky, indiánské kultury, kolonizace a vznik nových národů, státy, podnebí a hospodářství. Životopisy cestovatelů."
      ],
      "topics": [
        "z7/zemepis/severni-amerika",
        "z7/zemepis/stredni-a-jizni-amerika"
      ]
    },
    {
      "id": "vyrazy-a-vzorce",
      "title": "Výrazy a vzorce",
      "emoji": "🔣",
      "month": "říjen",
      "about": [
        "Mocniny a druhá odmocnina, výrazy, vytýkání a roznásobování, úvod do rovnic a počítání s písmeny. Konstrukce trojúhelníku, těžnice, výšky a součet úhlů."
      ],
      "topics": [
        "z8/matematika/druha-mocnina-odmocnina",
        "z8/matematika/vyrazy",
        "z8/matematika/linearni-rovnice",
        "z8/matematika/konstrukcni-ulohy"
      ]
    },
    {
      "id": "cukry-tuky-bilkoviny-skroby",
      "title": "Cukry, tuky, bílkoviny, škroby",
      "emoji": "🍞",
      "month": "listopad",
      "about": [
        "Bezpečnost, periodická soustava, zápis chemické reakce. Škrob od zrna k chlebu, cukry a fotosyntéza, bílkoviny a jejich srážení, tuky a mýdlo."
      ],
      "topics": [
        "z8/chemie/reakce-rovnice",
        "z9/chemie/sacharidy",
        "z9/chemie/tuky-bilkoviny",
        "z8/chemie/prvky-psp"
      ]
    },
    {
      "id": "pomery-s-machou",
      "title": "Poměry s Máchou",
      "emoji": "🌹",
      "month": "prosinec",
      "about": [
        "Větné členy, druhy přísudku, souvětí souřadné a podřadné a poměry mezi větami, interpunkce. Karel Hynek Mácha a Máj."
      ],
      "topics": [
        "z8/cestina/souveti-souradne",
        "z8/cestina/souveti-podradne",
        "z8/cestina/interpunkce",
        "z8/cestina/romantismus"
      ]
    },
    {
      "id": "prumyslova-revoluce",
      "title": "Průmyslová revoluce",
      "emoji": "🚂",
      "month": "leden",
      "about": [
        "Vynálezy, které proměnily svět, parní stroj a sociální otázka. Osvícenství, Marie Terezie a Josef II., francouzská revoluce, vznik USA, Napoleon a Evropa po roce 1815."
      ],
      "topics": [
        "z8/dejepis/prumyslova-revoluce",
        "z8/dejepis/osvicenstvi",
        "z8/dejepis/francouzska-revoluce",
        "z8/dejepis/vznik-usa",
        "z8/dejepis/napoleon"
      ]
    },
    {
      "id": "platonska-telesa",
      "title": "Platónská tělesa",
      "emoji": "🔷",
      "month": "únor",
      "about": [
        "Vzorce (a + b)², (a − b)² a a² − b², počítání s písmeny. Číslo π, obvod a obsah kruhu. Krychle, kvádr, válec a hranol – objem a povrch. Platónská tělesa a zlatý řez."
      ],
      "topics": [
        "z8/matematika/mnohocleny",
        "z8/matematika/kruh-kruznice",
        "z8/matematika/valec",
        "z7/matematika/hranoly",
        "z8/matematika/platonska-telesa"
      ]
    },
    {
      "id": "kostra-a-svalstvo",
      "title": "Člověk, jeho kostra a svalstvo",
      "emoji": "🦴",
      "month": "březen",
      "about": [
        "Opěrná soustava, páteř a vzpřímený postoj, ruka, pánev a noha, klenba chodidla, lebka, chrup a svaly."
      ],
      "topics": [
        "z8/prirodopis/kostra-svaly",
        "z5/prirodoveda/kostra-a-svaly"
      ]
    },
    {
      "id": "elektrina",
      "title": "Elektřina",
      "emoji": "⚡",
      "month": "duben",
      "about": [
        "Galvanický článek, vodiče a izolanty, elektrický obvod, elektromotor a výroba energie, střídavý a stejnosměrný proud. Skupenství, tlak, Pascalův a Archimédův zákon, teplo. Ekologické zdroje energie."
      ],
      "topics": [
        "z8/fyzika/proud-a-napeti",
        "z8/fyzika/ohmuv-zakon",
        "z8/fyzika/zapojeni-rezistoru",
        "z9/fyzika/elektromagnetismus",
        "z7/fyzika/tlak-v-kapalinach",
        "z7/fyzika/archimeduv-zakon",
        "z8/fyzika/zmeny-skupenstvi",
        "z8/fyzika/teplo"
      ]
    },
    {
      "id": "divadlo-a-literatura-19-stoleti",
      "title": "Divadlo a literatura 19. století",
      "emoji": "🎭",
      "month": "květen",
      "about": [
        "Národní obrození a formování jazyka, slovní zásoba a přejatá slova, drama, tragédie a komedie. Třída nacvičuje divadelní představení."
      ],
      "topics": [
        "z8/dejepis/narodni-obrozeni",
        "z8/cestina/slova-prejata",
        "z7/cestina/obohacovani-slovni-zasoby",
        "z8/cestina/realismus"
      ]
    },
    {
      "id": "dej-si-bacha",
      "title": "Dej si bacha!",
      "emoji": "🏭",
      "month": "červen",
      "about": [
        "Důsledky průmyslové revoluce, revoluce roku 1848, nové velmoci, chemický průmysl a ropa."
      ],
      "topics": [
        "z8/dejepis/revoluce-1848",
        "z8/dejepis/sjednoceni-italie-nemecka",
        "z9/chemie/nenasycene-uhlovodiky"
      ]
    }
  ],
  "ongoing": [
    {
      "id": "matematika",
      "title": "Matematika",
      "emoji": "📐",
      "about": [
        "V cvičných hodinách Pythagorova věta, kružnice a tečny, rovnice a slovní úlohy, objem a obsah, převody jednotek a základy statistiky."
      ],
      "topics": [
        "z8/matematika/pythagorova-veta",
        "z8/matematika/statistika",
        "z6/matematika/prevody-jednotek"
      ]
    },
    {
      "id": "clovek-a-priroda",
      "title": "Člověk a příroda",
      "emoji": "🔬",
      "about": [
        "Výchova ke zdraví, mechanika a Newtonovy zákony, rychlost, hustota a tlak."
      ],
      "topics": [
        "z8/prirodopis/rozmnozovani-cloveka",
        "z7/fyzika/newtonovy-zakony",
        "z7/fyzika/pohyb-a-rychlost",
        "z6/fyzika/hustota",
        "z7/fyzika/tlak"
      ]
    },
    {
      "id": "cestina",
      "title": "Český jazyk",
      "emoji": "📗",
      "about": [
        "Pravopis, skloňování obtížných slov, slohové útvary – popis, líčení, úvaha a charakteristika."
      ],
      "topics": [
        "z8/cestina/sklonovani-obtiznych-jmen",
        "z8/cestina/funkcni-styly",
        "z8/cestina/vyklad-uvaha"
      ]
    },
    {
      "id": "anglictina",
      "title": "Angličtina",
      "emoji": "🇬🇧",
      "about": [
        "Vynálezy, Austrálie a Nový Zéland, cestování, příroda a ohrožená zvířata, emoce. Předpřítomný čas, členy, modální slovesa a podmínkové věty."
      ],
      "topics": [
        "z8/anglictina/present-perfect-uvod",
        "z8/anglictina/present-perfect-vs-past-simple",
        "z8/anglictina/should-must-mustnt",
        "z9/anglictina/first-conditional"
      ]
    }
  ]
}
