{
  "$schema": "../../schema/approach-year.schema.json",
  "format": 1,
  "title": "6. třída",
  "epochs": [
    {
      "id": "zeme-a-vesmir",
      "title": "Země a vesmír",
      "emoji": "🌙",
      "month": "září",
      "about": [
        "Obloha, Měsíc a jeho fáze, Slunce, den a noc, roční období, rovnodennost a slunovrat. Tvar a pohyby Země, zeměpisná síť, časová pásma, vegetační pásy.",
        "Horniny: žula a rula, živec, křemen, slída, vápenec, čedič a břidlice."
      ],
      "topics": [
        "z6/zemepis/zeme-ve-vesmiru",
        "z6/zemepis/pohyby-zeme",
        "z6/zemepis/globus-a-mapa",
        "z6/zemepis/zemepisne-souradnice",
        "z6/zemepis/casova-pasma",
        "z9/prirodopis/nerosty",
        "z9/prirodopis/horniny"
      ]
    },
    {
      "id": "slovni-druhy",
      "title": "Slovní druhy",
      "emoji": "📖",
      "month": "říjen",
      "about": [
        "Druhy slov v textu, mluvnické kategorie podstatných jmen a sloves, slovesný rod, zájmena a číslovky, mě/mně, bě/bje, předpony s-, z-, vz-. Balady z Erbenovy Kytice."
      ],
      "topics": [
        "z6/cestina/podstatna-jmena",
        "z6/cestina/slovesa",
        "z7/cestina/slovesny-rod",
        "z6/cestina/zajmena",
        "z6/cestina/cislovky",
        "z6/cestina/predpony-s-z-vz"
      ]
    },
    {
      "id": "kupecke-pocty",
      "title": "Kupecké počty",
      "emoji": "💰",
      "month": "listopad",
      "about": [
        "Platidla, směnný obchod, vznik peněz a rozpočet. Desetinná čísla a desetinné zlomky, procenta (úroky, slevy, kurz, daně), dělitelnost a prvočísla. Na konci místo čísel písmena."
      ],
      "topics": [
        "z6/matematika/desetinna-cisla",
        "z6/matematika/desetinna-cisla-pocitani",
        "z7/matematika/procenta",
        "z6/matematika/nasobek-delitel",
        "z6/matematika/prvocisla",
        "z7/obcanska/hospodareni"
      ]
    },
    {
      "id": "staroveky-rim",
      "title": "Starověký Řím",
      "emoji": "🏟️",
      "month": "prosinec",
      "about": [
        "Romulus a Remus, království, republika s patricii a plebeji, punské války, Spartakus, Caesar, císařství, křesťanství a pád říše."
      ],
      "topics": [
        "z6/dejepis/starovek-rim"
      ]
    },
    {
      "id": "skladba",
      "title": "Skladba",
      "emoji": "🧱",
      "month": "leden",
      "about": [
        "Věta jednoduchá, podmět a přísudek, jmenný a slovesný přísudek, shoda s několikanásobným podmětem, přívlastek, předmět a příslovečná určení."
      ],
      "topics": [
        "z6/cestina/podmet-prisudek",
        "z6/cestina/shoda-prisudku",
        "z7/cestina/vetne-cleny"
      ]
    },
    {
      "id": "pozorovani-protikladu",
      "title": "Pozorování protikladů",
      "emoji": "🔊",
      "month": "únor",
      "about": [
        "Akustika (zvuk, nástroje, intervaly), teplo a chlad, světlo a stín, přitažlivost a odpuzování magnetů."
      ],
      "topics": [
        "z9/fyzika/zvuk",
        "z6/fyzika/teplota",
        "z8/fyzika/teplo",
        "z9/fyzika/svetlo",
        "z6/fyzika/magnety"
      ]
    },
    {
      "id": "rysovani-rovinnych-utvaru",
      "title": "Rýsování rovinných útvarů",
      "emoji": "📐",
      "month": "březen",
      "about": [
        "Útvary vepsané do kruhu, osová a středová souměrnost, druhy trojúhelníků a jejich shodnost, úhly, kružnice vepsaná a opsaná, Thaletova věta, kružítko a pravítko."
      ],
      "topics": [
        "z6/matematika/uhel",
        "z6/matematika/osova-soumernost",
        "z7/matematika/stredova-soumernost",
        "z6/matematika/trojuhelnik",
        "z8/matematika/konstrukcni-ulohy"
      ]
    },
    {
      "id": "zivot-ve-stredoveku",
      "title": "Život ve středověku",
      "emoji": "🏰",
      "month": "duben",
      "about": [
        "Slované, islám, Franská říše, lenní systém, kláštery a hrady, Velká Morava, Cyril a Metoděj, Přemyslovci a doba Karla IV."
      ],
      "topics": [
        "z7/dejepis/byzanc-islam",
        "z7/dejepis/franska-rise",
        "z7/dejepis/slovane-velka-morava",
        "z7/dejepis/stredoveka-spolecnost",
        "z7/dejepis/premyslovci",
        "z7/dejepis/lucemburkove"
      ]
    },
    {
      "id": "rostlinna-rise",
      "title": "Rostlinná říše",
      "emoji": "🌸",
      "month": "květen",
      "about": [
        "Jednoděložné a dvouděložné rostliny, pole, louka a les, květ a opylování."
      ],
      "topics": [
        "z7/prirodopis/stavba-rostlin",
        "z7/prirodopis/kvet-plod",
        "z7/prirodopis/krytosemenne",
        "z6/prirodopis/ekosystemy"
      ]
    },
    {
      "id": "evropa",
      "title": "Evropa",
      "emoji": "🗺️",
      "month": "červen",
      "about": [
        "Podnebí, hranice Evropy a Asie, krajiny, státy a hlavní města, zvyky. Práce s mapou a atlasem."
      ],
      "topics": [
        "z8/zemepis/evropa-priroda",
        "z8/zemepis/zapadni-a-jizni-evropa",
        "z8/zemepis/stredni-a-severni-evropa",
        "z8/zemepis/vychodni-a-jihovychodni-evropa"
      ]
    }
  ],
  "ongoing": [
    {
      "id": "matematika",
      "title": "Matematika",
      "emoji": "📐",
      "about": [
        "V cvičných hodinách zlomky, desetinná čísla, zaokrouhlování, procenta, aritmetický průměr, společný dělitel a násobek."
      ],
      "topics": [
        "z6/matematika/nsd-nsn",
        "z5/matematika/zlomky",
        "z8/matematika/statistika"
      ]
    },
    {
      "id": "obcanska",
      "title": "Občanská výchova",
      "emoji": "🏦",
      "about": [
        "Vlastnictví, peníze a placení, rozpočet domácnosti, banky, škola a její pravidla."
      ],
      "topics": [
        "z6/obcanska/skola",
        "z7/obcanska/majetek",
        "z9/obcanska/rozpocet",
        "z9/obcanska/banky"
      ]
    },
    {
      "id": "anglictina",
      "title": "Angličtina",
      "emoji": "🇬🇧",
      "about": [
        "Země a mapy, obchody a peníze, oblečení a národnosti, starověký Řím, hudba, zvířata a sport. Minulý čas, počitatelná podstatná jména a členy, stupňování."
      ],
      "topics": [
        "z6/anglictina/past-simple-pravidelna",
        "z6/anglictina/past-simple-nepravidelna",
        "z6/anglictina/past-simple-otazky-zapory",
        "z6/anglictina/countable-uncountable",
        "z7/anglictina/past-continuous",
        "z7/anglictina/comparatives",
        "z7/anglictina/adverbs-of-manner"
      ]
    }
  ]
}
