{
  "$schema": "../../schema/approach-year.schema.json",
  "format": 1,
  "title": "3. třída",
  "epochs": [
    {
      "id": "stvoreni-sveta",
      "title": "Stvoření světa",
      "emoji": "🌍",
      "month": "září",
      "about": [
        "Opakování 2. třídy, čtení, druhy vět, slova stejného, opačného a podobného významu. Vyprávěcí látkou jsou příběhy o stvoření světa."
      ],
      "topics": [
        "z2/cestina/druhy-vet",
        "z4/cestina/vyznam-slova"
      ]
    },
    {
      "id": "od-zrna-ke-chlebu",
      "title": "Od zrna ke chlebu",
      "emoji": "🌾",
      "month": "říjen",
      "about": [
        "Člověk a země: rolník a jeho práce, půda, obilí, vlastní políčko – výsev, měření pole, vážení surovin a nakonec chléb."
      ],
      "topics": [
        "z3/prvouka/od-zrna-ke-chlebu",
        "z3/prvouka/voda-vzduch-puda",
        "z4/prirodoveda/pole-a-zahrada"
      ]
    },
    {
      "id": "velka-cisla",
      "title": "Velká čísla",
      "emoji": "🏔️",
      "month": "listopad",
      "about": [
        "Desítková soustava, čísla přes 1000, sčítání a odčítání víceciferných čísel, odhady a kontrola výsledků, slovní úlohy, násobkové řady."
      ],
      "topics": [
        "z3/matematika/cisla-do-1000",
        "z3/matematika/scitani-odcitani-do-1000",
        "z3/matematika/zaokrouhlovani",
        "z4/matematika/cisla-do-milionu"
      ]
    },
    {
      "id": "pismo-a-rec",
      "title": "Písmo a řeč v průběhu věků",
      "emoji": "🪶",
      "month": "prosinec",
      "about": [
        "Psací písmo a jak se písmo vyvíjelo, psaní různými pomůckami a perem, krasopis. Slabiky bě, pě, vě, mě, dě, tě, ně. Hlasité čtení."
      ],
      "topics": [
        "z3/cestina/pismo-v-dejinach",
        "z2/cestina/de-te-ne-be-pe-ve-me"
      ]
    },
    {
      "id": "miry-a-vahy",
      "title": "Míry a váhy",
      "emoji": "⚖️",
      "month": "leden",
      "about": [
        "Jak se měřila délka, čas, objem a hmotnost dříve a dnes, vlastní měřidla, jednotky a jejich převody."
      ],
      "topics": [
        "z3/matematika/jednotky",
        "z3/prvouka/mereni",
        "z2/matematika/usecka-a-delka"
      ]
    },
    {
      "id": "cinnost-cloveka",
      "title": "Činnost člověka dříve a dnes",
      "emoji": "🔨",
      "month": "únor",
      "about": [
        "Prapůvodní povolání a tradiční řemesla, co lidé dělali dříve a co dnes. Slovní druhy: podstatná jména, přídavná jména, slovesa."
      ],
      "topics": [
        "z3/prvouka/remesla",
        "z2/prvouka/povolani",
        "z3/cestina/slovni-druhy"
      ]
    },
    {
      "id": "slovo-slucko-slovicko",
      "title": "Slovo, slůvko, slovíčko",
      "emoji": "💬",
      "month": "březen",
      "about": [
        "Opis, vlastní texty, diktáty, kontrola pravopisu a vyjmenovaná slova."
      ],
      "topics": [
        "z3/cestina/vyjmenovana-slova-b",
        "z3/cestina/vyjmenovana-slova-l",
        "z3/cestina/vyjmenovana-slova-m",
        "z3/cestina/vyjmenovana-slova-p"
      ]
    },
    {
      "id": "svet-cisel-rytmu-a-tvaru",
      "title": "Svět čísel, rytmu a tvaru",
      "emoji": "🔺",
      "month": "duben",
      "about": [
        "Násobkové řady a počítání zpaměti, víceciferná čísla, písemné násobení, záměna činitelů, osově souměrné útvary a tělesa."
      ],
      "topics": [
        "z3/matematika/nasobilka-6-10",
        "z3/matematika/deleni-v-nasobilce",
        "z3/matematika/nasobeni-mimo-nasobilku",
        "z4/matematika/pisemne-nasobeni",
        "z4/matematika/osova-soumernost",
        "z3/matematika/primka-kruznice",
        "z3/matematika/obvod"
      ]
    },
    {
      "id": "kolik-reci-umis",
      "title": "Kolik řečí umíš, tolikrát jsi člověkem",
      "emoji": "🗣️",
      "month": "květen",
      "about": [
        "Vyjmenovaná slova, věta a její znaky, interpunkce, spojování vět. Jazykolamy, recitace, správné dýchání a tempo řeči."
      ],
      "topics": [
        "z3/cestina/vyjmenovana-slova-s",
        "z3/cestina/vyjmenovana-slova-v",
        "z3/cestina/vyjmenovana-slova-z",
        "z4/cestina/veta-jednoducha-souveti"
      ]
    },
    {
      "id": "stavitelstvi",
      "title": "Stavitelství",
      "emoji": "🏠",
      "month": "červen",
      "about": [
        "Stavba domu dříve a dnes, materiály, bydlení a jak se měnil způsob života. Třída staví společnou stavbu."
      ],
      "topics": [
        "z3/prvouka/stavba-domu"
      ]
    }
  ],
  "ongoing": [
    {
      "id": "cestina",
      "title": "Český jazyk",
      "emoji": "📗",
      "about": [
        "V cvičných hodinách: slova nadřazená a podřazená, slovní druhy, psací písmo, dopisy a diktáty."
      ],
      "topics": [
        "z2/cestina/slova-nadrazena-podrazena",
        "z3/cestina/podstatna-jmena-rod-cislo-pad",
        "z3/cestina/slovesa-z3"
      ]
    },
    {
      "id": "anglictina",
      "title": "Angličtina",
      "emoji": "🇬🇧",
      "about": [
        "Škola a třída, rodina, zvířata, „I like / I don't like“, jaro, tělo a oblečení, jídlo, místa a předložky. První čtení slov."
      ],
      "topics": [
        "z3/anglictina/have-got",
        "z3/anglictina/i-like",
        "z3/anglictina/this-that",
        "z3/anglictina/a-an",
        "z4/anglictina/predlozky-mista"
      ]
    }
  ]
}
