{
  "$schema": "../../schema/approach-year.schema.json",
  "format": 1,
  "title": "11. třída (lyceum)",
  "epochs": [
    {
      "id": "umeni-videt-obraz",
      "title": "Umění – vidět obraz",
      "emoji": "🎨",
      "month": "září",
      "about": [
        "Co je umění a jak ho vnímáme, symboly a odkazy, polarity: realismus a romantismus, impresionismus a expresionismus, dynamika a statika."
      ],
      "topics": [
        "s2/literatura/romantismus-svetovy",
        "s2/literatura/realismus-svetovy"
      ]
    },
    {
      "id": "krajina-a-ekologie",
      "title": "Krajina a životní prostředí",
      "emoji": "🏞️",
      "month": "říjen",
      "about": [
        "Vztah reliéfu, podnebí, rostlinstva a člověka, krajina jako ekosystém, typy krajiny a krajinotvorné procesy. Ekologické praktikum na školním pozemku."
      ],
      "topics": [
        "s1/zemepis/pedosfera-biosfera-s",
        "s1/zemepis/exogenni-procesy",
        "s3/biologie/ekologie",
        "z9/zemepis/zivotni-prostredi"
      ]
    },
    {
      "id": "planimetrie-a-stereometrie",
      "title": "Planimetrie, stereometrie a analytická geometrie",
      "emoji": "📏",
      "month": "listopad",
      "about": [
        "Shodnost a podobnost trojúhelníků, Euklidovy věty, množiny bodů, zobrazení v rovině, tělesa a jejich řezy, vektory a přímka."
      ],
      "topics": [
        "s1/matematika/trojuhelniky",
        "s1/matematika/kruznice-mnohouhelniky",
        "s3/matematika/polohove-ulohy",
        "s3/matematika/telesa",
        "s3/matematika/vektory",
        "s3/matematika/primka-v-rovine"
      ]
    },
    {
      "id": "parsifal",
      "title": "Parsifal",
      "emoji": "🛡️",
      "month": "prosinec",
      "about": [
        "Četba a rozbor Parsifala: dětství, odchod od matky, bloudění a cesta za Grálem jako obraz cesty člověka. Středověký epos a jeho doba."
      ],
      "topics": [
        "s2/literatura/parsifal",
        "s1/literatura/stredovek-evropa"
      ]
    },
    {
      "id": "elektrina-kmitani-vlneni",
      "title": "Elektřina, kmitání a vlnění",
      "emoji": "⚡",
      "month": "leden",
      "about": [
        "Elektrostatika a kondenzátor, Ohmův zákon a výkon, polovodiče, magnetické pole proudu, indukce, střídavý proud. Kmitání, zvuk a struna."
      ],
      "topics": [
        "s2/fyzika/elektricky-naboj",
        "s2/fyzika/elektricke-pole",
        "s3/fyzika/proud-v-kovech",
        "s3/fyzika/proud-v-latkach",
        "s3/fyzika/magneticke-pole",
        "s3/fyzika/elektromagneticka-indukce",
        "s3/fyzika/stridavy-proud",
        "s2/fyzika/mechanicke-kmitani",
        "s2/fyzika/mechanicke-vlneni"
      ]
    },
    {
      "id": "chemie",
      "title": "Chemie: prvky, kovy a nekovy",
      "emoji": "🧪",
      "month": "únor",
      "about": [
        "Kvantitativní pohled na chemické děje, oxidace a redukce, kovy a nekovy v životě i v praxi, periodická soustava, koloběh látek v přírodě."
      ],
      "topics": [
        "s1/chemie/psp",
        "s1/chemie/latkove-mnozstvi",
        "s1/chemie/vypocty-z-rovnic",
        "z9/chemie/redoxni-reakce",
        "s2/chemie/kyslik-sira",
        "s2/chemie/d-prvky-vyznamne"
      ]
    },
    {
      "id": "rim-a-stredovek",
      "title": "Řím a středověk",
      "emoji": "🏰",
      "month": "březen",
      "about": [
        "Řím a jeho pád, Západ a Východ, rané křesťanství, církev a panovníci, středověký obraz světa, města a život prostého lidu, přerod v humanismus."
      ],
      "topics": [
        "s1/dejepis/rim-cisarstvi",
        "s2/dejepis/byzanc-islam",
        "s2/dejepis/franska-rise-svata-rise",
        "s2/dejepis/vrcholny-pozdni-stredovek",
        "s2/dejepis/objevy-renesance-reformace"
      ]
    },
    {
      "id": "projektivni-geometrie",
      "title": "Projektivní geometrie a kombinatorika",
      "emoji": "🔭",
      "month": "duben",
      "about": [
        "Perspektiva, nekonečně vzdálený bod, princip duality, kuželosečky. Variace, permutace a kombinace. Platónská tělesa a zlatý řez."
      ],
      "topics": [
        "s3/matematika/kuzelosecky",
        "s3/matematika/kombinatorika",
        "z8/matematika/platonska-telesa"
      ]
    },
    {
      "id": "dejiny-hudby",
      "title": "Dějiny hudby",
      "emoji": "🎼",
      "month": "květen",
      "about": [
        "Velcí skladatelé a jejich doba, hudba klasicismu a hlavně romantismu, polarity v hudbě a její formě. Živý poslech."
      ],
      "topics": [
        "s2/literatura/romantismus-svetovy"
      ]
    },
    {
      "id": "bunka-a-genetika",
      "title": "Buňka, mikroorganismy a genetika",
      "emoji": "🔬",
      "month": "červen",
      "about": [
        "Vlastnosti živých soustav, typy buněk a jejich dělení, bakterie a viry, vznik pohlavních buněk, vývoj člověka před narozením, dědičnost."
      ],
      "topics": [
        "s1/biologie/bunka-stavba",
        "s1/biologie/bunecny-cyklus",
        "s1/biologie/viry",
        "s1/biologie/bakterie",
        "s3/biologie/rozmnozovani-ontogeneze",
        "s3/biologie/mendelovska-genetika"
      ]
    }
  ],
  "ongoing": [
    {
      "id": "matematika",
      "title": "Matematika",
      "emoji": "📐",
      "about": [
        "Blok matematiky: kvadratické rovnice a nerovnice, binomická věta, goniometrické, exponenciální a logaritmické rovnice, absolutní hodnota."
      ],
      "topics": [
        "s1/matematika/kvadraticke-rovnice",
        "s3/matematika/binomicka-veta",
        "s2/matematika/goniometricke-rovnice",
        "s2/matematika/exponencialni-funkce",
        "s2/matematika/logaritmus",
        "s1/matematika/absolutni-hodnota"
      ]
    },
    {
      "id": "hospodarstvi",
      "title": "Hospodářství",
      "emoji": "💼",
      "about": [
        "Peníze a platby, úroky a RPSN, pojištění, inflace, úvěry, podnikání a daně."
      ],
      "topics": [
        "s3/zsv/penize-banky-inflace",
        "s3/zsv/financni-gramotnost",
        "s3/zsv/stat-v-ekonomice"
      ]
    },
    {
      "id": "cestina",
      "title": "Český jazyk a literatura",
      "emoji": "📗",
      "about": [
        "Písemnictví od Velké Moravy po Karla IV., pověsti a kroniky, středověk a renesance, humanismus, baroko, klasicismus a preromantismus, obecná jazykověda."
      ],
      "topics": [
        "s1/cestina/jazyk-a-jazykoveda",
        "s1/literatura/cesky-stredovek",
        "s1/literatura/renesance-humanismus",
        "s1/literatura/baroko",
        "s2/literatura/klasicismus",
        "s2/literatura/preromantismus"
      ]
    },
    {
      "id": "anglictina",
      "title": "Angličtina",
      "emoji": "🇬🇧",
      "about": [
        "Cestování, přání, politika a povolání, dějiny, britská a americká literatura. Used to a would, podmínkové věty, předpřítomný čas, gerundium a infinitiv, tázací dovětky."
      ],
      "topics": [
        "s2/anglictina/used-to-be-used-to",
        "s2/anglictina/conditionals-0-1-2",
        "s2/anglictina/wish-if-only",
        "s3/anglictina/third-conditional",
        "s2/anglictina/gerund-infinitive",
        "s2/anglictina/question-tags"
      ]
    }
  ]
}
