{
  "$schema": "../../schema/approach-year.schema.json",
  "format": 1,
  "title": "2. třída",
  "epochs": [
    {
      "id": "jako-v-zrcadle",
      "title": "Jako v zrcadle",
      "emoji": "🪞",
      "month": "září",
      "about": [
        "Svislá souměrnost ve formách, na papíře i v prostoru. Soužití a slušné chování, úcta ke stáří, legendy svatých."
      ],
      "topics": [
        "z4/matematika/osova-soumernost",
        "z2/prvouka/domov-a-adresa"
      ]
    },
    {
      "id": "rise-pismen",
      "title": "Říše písmen",
      "emoji": "🔡",
      "month": "říjen",
      "about": [
        "Abeceda, malá tiskací písmena, slova v textu, tvrdé a měkké slabiky. Slova se dělí na slabiky rytmem. Bajky a legendy."
      ],
      "topics": [
        "z2/cestina/abeceda",
        "z2/cestina/veta-slovo-slabika-hlaska",
        "z2/cestina/tvrde-mekke-obojetne"
      ]
    },
    {
      "id": "rise-cisel",
      "title": "Říše čísel",
      "emoji": "🔢",
      "month": "listopad",
      "about": [
        "Všechny základní operace a známé násobkové řady, nové řady rytmicky. Porovnávání, odhady, číselná osa, počítání s desítkami do 100, řády a čísla přes 100."
      ],
      "topics": [
        "z2/matematika/cisla-do-100",
        "z2/matematika/scitani-odcitani-do-100",
        "z2/matematika/nasobilka-2-3"
      ]
    },
    {
      "id": "zaciname-cist",
      "title": "Začínáme číst",
      "emoji": "📖",
      "month": "prosinec",
      "about": [
        "Malá tiskací písmena, velké písmeno u vlastních jmen, čtení z vlastních čítanek. Melodie věty podle toho, co chceme říct."
      ],
      "topics": [
        "z1/cestina/velka-a-mala-pismena",
        "z2/cestina/druhy-vet"
      ]
    },
    {
      "id": "o-kolik-poskocis",
      "title": "O kolik poskočíš",
      "emoji": "🐸",
      "month": "leden",
      "about": [
        "Násobkové řady, počítání zpaměti, úlohy s více početními kroky, sčítání a odčítání do 100 bez přechodu přes desítku, záměna sčítanců i činitelů."
      ],
      "topics": [
        "z2/matematika/nasobeni-uvod",
        "z2/matematika/nasobilka-4-5",
        "z3/matematika/nasobilka-6-10"
      ]
    },
    {
      "id": "priprava-na-psani",
      "title": "Příprava na psaní",
      "emoji": "✍️",
      "month": "únor",
      "about": [
        "Vodorovná souměrnost a dynamické kreslení forem jako příprava na psací písmo. Osobní bezpečí a zdraví."
      ],
      "topics": [
        "z2/prvouka/zdravi-a-smysly"
      ]
    },
    {
      "id": "cteme-a-piseme",
      "title": "Čteme a píšeme",
      "emoji": "📝",
      "month": "březen",
      "about": [
        "Slova, slabiky a hlásky; ú a ů; dě, tě, ně, bě, pě, vě; párové souhlásky. Básně, rýmy, hádanky a přednes."
      ],
      "topics": [
        "z2/cestina/samohlasky-a-souhlasky",
        "z2/cestina/u-u-u",
        "z2/cestina/de-te-ne-be-pe-ve-me",
        "z2/cestina/dy-ty-ny-di-ti-ni",
        "z2/cestina/parove-souhlasky"
      ]
    },
    {
      "id": "orientace-v-case",
      "title": "Orientace v čase",
      "emoji": "🕰️",
      "month": "duben",
      "about": [
        "Násobkové řady, sčítání a odčítání do 100 s přechodem přes desítku, číselná osa do 1000. Rok, měsíc, den, hodina, minuta."
      ],
      "topics": [
        "z2/matematika/prechod-desitky-do-100",
        "z2/matematika/hodiny",
        "z2/prvouka/kalendar"
      ]
    },
    {
      "id": "co-vsechno-umime",
      "title": "Co všechno umíme?",
      "emoji": "🎈",
      "month": "květen",
      "about": [
        "Opakování 2. třídy: měkké a tvrdé slabiky, práce s textem, vymýšlení příběhů, jazykové hry. Dopravní výchova."
      ],
      "topics": [
        "z2/cestina/slova-nadrazena-podrazena",
        "z1/prvouka/cesta-do-skoly"
      ]
    },
    {
      "id": "svet-tvaru",
      "title": "Svět tvarů",
      "emoji": "🔷",
      "month": "červen",
      "about": [
        "Nácvik násobilky. Čtení, zápis a porovnávání čísel do 1000. Lomená čára, čtverec, obdélník, trojúhelník, kruh."
      ],
      "topics": [
        "z2/matematika/usecka-a-delka",
        "z1/matematika/geometricke-tvary",
        "z3/matematika/cisla-do-1000"
      ]
    }
  ],
  "ongoing": [
    {
      "id": "priroda-v-roce",
      "title": "Proměny přírody v roce",
      "emoji": "🍂",
      "about": [
        "Celý rok se sleduje, jak se příroda mění: stromy, rostliny a zvířata v každém ročním období."
      ],
      "topics": [
        "z2/prvouka/rostliny-a-stromy",
        "z2/prvouka/zvirata-domaci-a-volne",
        "z1/prvouka/rocni-obdobi"
      ]
    },
    {
      "id": "anglictina",
      "title": "Angličtina",
      "emoji": "🇬🇧",
      "about": [
        "Pozdravy, barvy, čísla do 100, počasí a oblečení, dny a měsíce, zvířata a emoce. Hry, písničky, básničky a příběhy."
      ],
      "topics": [
        "z3/anglictina/pozdravy",
        "z3/anglictina/cisla-barvy",
        "z3/anglictina/i-am-you-are",
        "z3/anglictina/i-like"
      ]
    }
  ]
}
