{
  "$schema": "../../schema/approach-year.schema.json",
  "format": 1,
  "title": "4. třída",
  "epochs": [
    {
      "id": "moje-mesto",
      "title": "Vlastivěda – moje město",
      "emoji": "🏘️",
      "month": "září",
      "about": [
        "Nebe a země, světové strany, horizont, pouť Slunce během dne a roku. Pohled shora – třída, pokojíček, město. Orientace na mapě, dějiny vlastního města a jeho pověsti."
      ],
      "topics": [
        "z4/vlastiveda/mapa-a-svetove-strany",
        "z3/prvouka/obec-a-mapa",
        "z3/prvouka/svetove-strany",
        "z4/vlastiveda/pravek-a-povesti"
      ]
    },
    {
      "id": "jazyk-jazycek",
      "title": "Jazyk, jazýček",
      "emoji": "👅",
      "month": "říjen",
      "about": [
        "Dokončení polních prací – mlácení, mletí, pečení chleba, výroba másla. Spodoba znělosti, vyjmenovaná slova a slova příbuzná. Severské pohádky."
      ],
      "topics": [
        "z2/cestina/parove-souhlasky",
        "z4/cestina/koren-slova-pribuzna",
        "z3/cestina/vyjmenovana-slova-b"
      ]
    },
    {
      "id": "pocty",
      "title": "Počty",
      "emoji": "🧮",
      "month": "listopad",
      "about": [
        "Čtyřúhelníky, přednost operací, velká čísla, písemné sčítání, odčítání a násobení, dělení se zbytkem, písemné dělení, slovní úlohy. Vyprávěcí látkou je severská mytologie."
      ],
      "topics": [
        "z4/matematika/cisla-do-milionu",
        "z4/matematika/pisemne-scitani-odcitani",
        "z4/matematika/pisemne-nasobeni",
        "z4/matematika/deleni-se-zbytkem",
        "z5/matematika/pisemne-deleni",
        "z4/matematika/rovnobezky-kolmice"
      ]
    },
    {
      "id": "jak-piseme-a-mluvime",
      "title": "Jak píšeme a mluvíme",
      "emoji": "🖋️",
      "month": "prosinec",
      "about": [
        "Vyjmenovaná slova a záludné dvojice, stavba slova (kořen, předpona, přípona), slovesa – osoba, číslo, čas."
      ],
      "topics": [
        "z4/cestina/stavba-slova-z4",
        "z4/cestina/predlozky-a-predpony",
        "z4/cestina/slovesa-urcovani"
      ]
    },
    {
      "id": "stedrost-cisel",
      "title": "Štědrost čísel",
      "emoji": "🍰",
      "month": "leden",
      "about": [
        "Zlomek jako díl celku a jako část celku, porovnávání zlomků, zlomky v praxi a slovní úlohy."
      ],
      "topics": [
        "z4/matematika/zlomky-uvod",
        "z5/matematika/zlomky"
      ]
    },
    {
      "id": "ohybej-se-slovicko",
      "title": "Ohýbej se, slovíčko",
      "emoji": "🌿",
      "month": "únor",
      "about": [
        "Slovní druhy, hlavně ohebné; rod, číslo, pád a vzor; synonyma a antonyma; spisovná a nespisovná slova."
      ],
      "topics": [
        "z3/cestina/slovni-druhy",
        "z3/cestina/podstatna-jmena-rod-cislo-pad",
        "z4/cestina/vyznam-slova"
      ]
    },
    {
      "id": "ten-da-to",
      "title": "Ten dá to a ten zas tohle",
      "emoji": "🥧",
      "month": "březen",
      "about": [
        "Sčítání a odčítání zlomků, smíšená čísla, krácení a rozšiřování, společný jmenovatel, násobení zlomků. Čím je číslo dělitelné – „královská a žebrácká čísla“."
      ],
      "topics": [
        "z7/matematika/zlomky-zaklad",
        "z7/matematika/zlomky-scitani",
        "z6/matematika/nasobek-delitel",
        "z7/matematika/zlomky-nasobeni"
      ]
    },
    {
      "id": "hratky-s-jazykem",
      "title": "Hrátky s jazykem",
      "emoji": "🎭",
      "month": "duben",
      "about": [
        "Vyjmenovaná slova, slovní druhy, vzory podstatných jmen a pravopis koncovek."
      ],
      "topics": [
        "z4/cestina/vzory-muzsky-rod",
        "z4/cestina/vzory-zensky-rod",
        "z4/cestina/vzory-stredni-rod",
        "z5/cestina/koncovky-podstatnych-jmen"
      ]
    },
    {
      "id": "clovek-a-zivocisna-rise",
      "title": "Člověk a živočišná říše",
      "emoji": "🦉",
      "month": "květen",
      "about": [
        "Lidské tělo a jak funguje, člověk a zvíře – co mají společné a čím se liší, stavba těla zvířat, zdravá strava."
      ],
      "topics": [
        "z3/prvouka/clovek",
        "z3/prvouka/zivocichove",
        "z4/prirodoveda/trideni-zivocichu",
        "z5/prirodoveda/zdravi-a-prvni-pomoc"
      ]
    },
    {
      "id": "co-se-deje-kolem-nas",
      "title": "Co se děje kolem nás",
      "emoji": "📰",
      "month": "červen",
      "about": [
        "Slovní druhy a pravopis v textech, zpráva, dopis a žádost, opakování 4. třídy."
      ],
      "topics": [
        "z4/cestina/podmet-a-prisudek",
        "z4/cestina/veta-jednoducha-souveti"
      ]
    }
  ],
  "ongoing": [
    {
      "id": "matematika",
      "title": "Matematika",
      "emoji": "📐",
      "about": [
        "V cvičných hodinách písemné počítání, počítání do milionu, zlomky a na konci roku tabulky a jízdní řády."
      ],
      "topics": [
        "z4/matematika/zaokrouhlovani-velkych-cisel",
        "z5/matematika/tabulky-diagramy"
      ]
    },
    {
      "id": "anglictina",
      "title": "Angličtina",
      "emoji": "🇬🇧",
      "about": [
        "Rodina a můj den, bydlení, zvířata, jaro a oblečení, jídlo. Sloveso být a mít, přítomný čas, předložky, like, zápor, množné číslo."
      ],
      "topics": [
        "z4/anglictina/to-be",
        "z4/anglictina/have-got-otazky",
        "z4/anglictina/present-simple-uvod",
        "z4/anglictina/predlozky-mista",
        "z4/anglictina/mnozne-cislo",
        "z4/anglictina/there-is-are"
      ]
    }
  ]
}
