{
  "$schema": "../../schema/approach-year.schema.json",
  "format": 1,
  "title": "7. třída",
  "epochs": [
    {
      "id": "vyziva-a-zdravi",
      "title": "Výživa a zdraví člověka",
      "emoji": "🥗",
      "month": "září",
      "about": [
        "Orgánové soustavy, zdravá strava a její složky, návykové látky, prevence a léčba nemocí."
      ],
      "topics": [
        "z8/prirodopis/traveni",
        "z8/prirodopis/dychani",
        "z8/prirodopis/krev-obeh",
        "z8/prirodopis/kuze-vylucovani",
        "z8/prirodopis/nervy-smysly",
        "z8/prirodopis/zdravi-prvni-pomoc"
      ]
    },
    {
      "id": "svet-celych-cisel",
      "title": "Svět celých čísel",
      "emoji": "➖",
      "month": "říjen",
      "about": [
        "Pořadí operací a závorky, záporná čísla, procenta, poměr a měřítko mapy, trojčlenka, přímá a nepřímá úměrnost, prvočísla a dělitelnost."
      ],
      "topics": [
        "z7/matematika/cela-cisla",
        "z7/matematika/procenta",
        "z7/matematika/pomer",
        "z7/matematika/umernost",
        "z6/matematika/prvocisla"
      ]
    },
    {
      "id": "carky-ve-vetach",
      "title": "Čárky ve větách a role slov",
      "emoji": "✒️",
      "month": "listopad",
      "about": [
        "Souvětí, věta hlavní a vedlejší, druhy vedlejších vět, čárka v souvětí podřadném, popis a charakteristika. Vyprávěcí látkou jsou Karel IV., Václav IV. a Zikmund."
      ],
      "topics": [
        "z7/cestina/druhy-vedlejsich-vet",
        "z8/cestina/souveti-podradne",
        "z8/cestina/interpunkce",
        "z7/cestina/popis-charakteristika",
        "z7/dejepis/lucemburkove"
      ]
    },
    {
      "id": "na-ceste-ke-svobode-mysleni",
      "title": "Na cestě ke svobodě myšlení",
      "emoji": "📜",
      "month": "prosinec",
      "about": [
        "Jan Hus a husitství, Jiří z Poděbrad a Jednota bratrská, stoletá válka a Johanka z Arku, knihtisk a zrod renesance."
      ],
      "topics": [
        "z7/dejepis/husitstvi",
        "z7/dejepis/jiri-jagellonci",
        "z7/dejepis/renesance-reformace"
      ]
    },
    {
      "id": "ohen",
      "title": "Oheň",
      "emoji": "🔥",
      "month": "leden",
      "about": [
        "Bezpečná práce a varovné značky, prvky a jejich značky, směsi. Hoření, kyseliny a zásady, pH a neutralizace, vápenec a vápno."
      ],
      "topics": [
        "z8/chemie/latky-vlastnosti",
        "z8/chemie/smesi",
        "z8/chemie/prvky-psp",
        "z8/chemie/oxidy",
        "z8/chemie/kyseliny",
        "z8/chemie/hydroxidy-ph"
      ]
    },
    {
      "id": "cesky-jazyk",
      "title": "Český jazyk",
      "emoji": "🔤",
      "month": "únor",
      "about": [
        "Stavba slova, odvozování, zkratky a složeniny, neohebné slovní druhy, slovesný vid, práce s textem a eseje."
      ],
      "topics": [
        "z7/cestina/obohacovani-slovni-zasoby",
        "z7/cestina/neohebne-slovni-druhy",
        "z7/cestina/slovesny-vid"
      ]
    },
    {
      "id": "co-se-stane-kdyz",
      "title": "Pozorování: co se stane, když…",
      "emoji": "🔦",
      "month": "březen",
      "about": [
        "Lom světla a čočky, optické klamy, magnetismus, elektrostatika a galvanický článek. Páka, kladka a těžiště. Životopisy vědců."
      ],
      "topics": [
        "z9/fyzika/lom-a-cocky",
        "z6/fyzika/magnety",
        "z8/fyzika/elektricky-naboj",
        "z6/fyzika/elektricky-obvod",
        "z7/fyzika/paka-a-kladka"
      ]
    },
    {
      "id": "po-stopach-marca-pola",
      "title": "Po stopách Marca Pola",
      "emoji": "🐫",
      "month": "duben",
      "about": [
        "Asie po Hedvábné stezce: Přední východ a pouště, Rusko, Mongolsko, Himálaj, Čína, Japonsko, Indonésie a Indie."
      ],
      "topics": [
        "z7/zemepis/asie-priroda",
        "z7/zemepis/asie-staty"
      ]
    },
    {
      "id": "umocnovani",
      "title": "Umocňování",
      "emoji": "²",
      "month": "květen",
      "about": [
        "Roznásobování závorek, opačná čísla a absolutní hodnota, mocniny. Obvod a obsah, konstrukce trojúhelníku, osa úhlu, kružnice opsaná a vepsaná, Thaletova věta, výšky a těžnice."
      ],
      "topics": [
        "z8/matematika/mocniny-exponent",
        "z8/matematika/druha-mocnina-odmocnina",
        "z6/matematika/trojuhelnik",
        "z8/matematika/konstrukcni-ulohy"
      ]
    },
    {
      "id": "objevne-cesty",
      "title": "Objevné cesty",
      "emoji": "⛵",
      "month": "červen",
      "about": [
        "Hledání cesty do Indie, Jindřich Mořeplavec, Diaz, Vasco da Gama, Kolumbus a Magalhães; Afrika a její obyvatelé. Reformace, rudolfinská doba a stavovské povstání."
      ],
      "topics": [
        "z7/dejepis/zamorske-objevy",
        "z7/zemepis/afrika-priroda",
        "z7/zemepis/afrika-obyvatelstvo",
        "z8/dejepis/tricetileta-valka"
      ]
    }
  ],
  "ongoing": [
    {
      "id": "fyzika",
      "title": "Mechanika",
      "emoji": "🏗️",
      "about": [
        "Týdenní projekt: mechanická síla, skládání sil, páka, rovnováha a kladky."
      ],
      "topics": [
        "z7/fyzika/sila-gravitacni",
        "z7/fyzika/skladani-sil",
        "z7/fyzika/paka-a-kladka"
      ]
    },
    {
      "id": "clovek-a-dusevni-zdravi",
      "title": "Člověk a duševní zdraví",
      "emoji": "🫶",
      "about": [
        "Vztahy a komunikace, kultura, morálka, rozdíly mezi lidmi a tolerance."
      ],
      "topics": [
        "z8/obcanska/vztahy",
        "z7/obcanska/kultura",
        "z7/obcanska/moralka",
        "z7/obcanska/tolerance"
      ]
    },
    {
      "id": "anglictina",
      "title": "Angličtina",
      "emoji": "🇬🇧",
      "about": [
        "Školní předměty, popis lidí, anglicky mluvící země, zdraví a technologie. Stupňování, minulý čas prostý a průběhový, členy, modální slovesa, will a going to."
      ],
      "topics": [
        "z7/anglictina/past-simple-vs-continuous",
        "z7/anglictina/comparatives",
        "z7/anglictina/superlatives",
        "z7/anglictina/must-have-to",
        "z7/anglictina/going-to-vs-will"
      ]
    }
  ]
}
