{
  "$schema": "../../schema/approach-year.schema.json",
  "format": 1,
  "title": "5. třída",
  "epochs": [
    {
      "id": "zeme-v-srdci-evropy",
      "title": "Země v srdci Evropy",
      "emoji": "🇨🇿",
      "month": "září",
      "about": [
        "Státní znak, hymna a hlavní město. Kraje, města, řeky, hory a krajiny Česka a život v nich, sousední státy, podnebí a roční období. Mapa a atlas. České pověsti."
      ],
      "topics": [
        "z4/vlastiveda/statni-symboly",
        "z4/vlastiveda/praha",
        "z4/vlastiveda/cr-poloha-a-povrch",
        "z4/vlastiveda/vodstvo-cr",
        "z5/vlastiveda/kraje-cr",
        "z5/vlastiveda/cechy-morava-slezsko",
        "z5/vlastiveda/evropa-a-sousede"
      ]
    },
    {
      "id": "pocitame-se-zlomky",
      "title": "Počítáme se zlomky",
      "emoji": "🧁",
      "month": "říjen",
      "about": [
        "Všechny početní operace, násobení a dělení 10, 100 a 1000, dělení dvojciferným číslem, zaokrouhlování. Zlomky: porovnávání, rozšiřování, krácení, společný jmenovatel. Čtyřúhelníky. Epos o Gilgamešovi."
      ],
      "topics": [
        "z5/matematika/pisemne-deleni",
        "z4/matematika/zaokrouhlovani-velkych-cisel",
        "z5/matematika/zlomky",
        "z7/matematika/zlomky-scitani"
      ]
    },
    {
      "id": "staroveke-civilizace",
      "title": "Starověké civilizace",
      "emoji": "🏺",
      "month": "listopad",
      "about": [
        "Časová osa a generace. Lovci a sběrači, první zemědělci, Mezopotámie s klínovým písmem a Chammurapiho zákoníkem, Egypt a Nil."
      ],
      "topics": [
        "z6/dejepis/uvod-do-dejepisu",
        "z6/dejepis/doba-kamenna",
        "z6/dejepis/mezopotamie",
        "z6/dejepis/egypt"
      ]
    },
    {
      "id": "hezky-cesky",
      "title": "Hezky česky",
      "emoji": "📚",
      "month": "prosinec",
      "about": [
        "Vyjmenovaná slova a vzory, zájmena, mluvnické kategorie sloves, příslovce a jejich stupňování, větné členy jako hra se slovy. Čtenářské dílny."
      ],
      "topics": [
        "z5/cestina/zajmena",
        "z4/cestina/slovesa-urcovani",
        "z7/cestina/neohebne-slovni-druhy"
      ]
    },
    {
      "id": "clovek-zvire-a-zeme",
      "title": "Člověk, zvíře a země",
      "emoji": "🐾",
      "month": "leden",
      "about": [
        "Znaky života, projevy chování a stavba těla vybraných zvířat. Zvířata podle prostředí a živlů."
      ],
      "topics": [
        "z6/prirodopis/projevy-zivota",
        "z4/prirodoveda/trideni-zivocichu",
        "z8/prirodopis/savci-znaky"
      ]
    },
    {
      "id": "hrajeme-si-s-vetami",
      "title": "Hrajeme si s větami",
      "emoji": "🧩",
      "month": "únor",
      "about": [
        "Podmět a přísudek, shoda přísudku s podmětem, věta jednoduchá a souvětí, spojky. Přídavná jména tvrdá, měkká a přivlastňovací, jejich stupňování."
      ],
      "topics": [
        "z4/cestina/podmet-a-prisudek",
        "z5/cestina/shoda-prisudku-s-podmetem",
        "z4/cestina/veta-jednoducha-souveti",
        "z5/cestina/pridavna-jmena"
      ]
    },
    {
      "id": "mensi-nez-jedna",
      "title": "Menší než jedna",
      "emoji": "🔬",
      "month": "březen",
      "about": [
        "Násobení a dělení zlomků, desetinné zlomky a desetinná čísla, zaokrouhlování, záporná čísla na teploměru a ve výtahu. Řecké báje."
      ],
      "topics": [
        "z7/matematika/zlomky-nasobeni",
        "z5/matematika/desetinna-cisla",
        "z5/matematika/zaporna-cisla"
      ]
    },
    {
      "id": "prima-a-neprima-rec",
      "title": "Přímá a nepřímá řeč",
      "emoji": "💭",
      "month": "duben",
      "about": [
        "Shoda podmětu s přísudkem, stavba slova a slova příbuzná, rozhovor a přímá řeč."
      ],
      "topics": [
        "z5/cestina/stavba-slova-z5",
        "z5/cestina/prima-rec"
      ]
    },
    {
      "id": "recko",
      "title": "Řecko",
      "emoji": "🏛️",
      "month": "květen",
      "about": [
        "Kréta a Mykény, Sparta a Athény, bohové, divadlo, demokracie a olympiáda, řecko-perské války a Alexandr Veliký."
      ],
      "topics": [
        "z6/dejepis/starovek-recko",
        "z7/cestina/myty-antika"
      ]
    },
    {
      "id": "v-risi-rostlin",
      "title": "V říši rostlin",
      "emoji": "🌱",
      "month": "červen",
      "about": [
        "Kořen, stonek, list a květ. Les jako celek, houby, lišejníky, mechy, kapradiny a jehličnany."
      ],
      "topics": [
        "z4/prirodoveda/stavba-rostlin",
        "z4/prirodoveda/les",
        "z6/prirodopis/houby-lisejniky",
        "z7/prirodopis/mechy-kapradiny",
        "z7/prirodopis/nahosemenne"
      ]
    }
  ],
  "ongoing": [
    {
      "id": "matematika",
      "title": "Matematika",
      "emoji": "📐",
      "about": [
        "V cvičných hodinách pořadí operací a závorky, jednotky, počítání pod sebou, obvod a obsah ve čtvercové síti, desetinná čísla."
      ],
      "topics": [
        "z5/matematika/obsah-a-jednotky",
        "z3/matematika/obvod",
        "z5/matematika/souradnice"
      ]
    },
    {
      "id": "anglictina",
      "title": "Angličtina",
      "emoji": "🇬🇧",
      "about": [
        "Já a moje rodina, oblečení, mapa, zvířata a země světa, jídlo a restaurace. There is/are, přítomný čas prostý a průběhový, příslovce častosti, otázky, minulý čas."
      ],
      "topics": [
        "z5/anglictina/present-simple-otazky-zapory",
        "z5/anglictina/frekvencni-prislovce",
        "z5/anglictina/otazkova-slova",
        "z5/anglictina/present-continuous",
        "z6/anglictina/past-simple-pravidelna"
      ]
    }
  ]
}
