{
  "$schema": "../../schema/approach-year.schema.json",
  "format": 1,
  "title": "9. třída",
  "epochs": [
    {
      "id": "zeme-jeji-nitro",
      "title": "Země, její nitro a život člověka",
      "emoji": "🌋",
      "month": "září",
      "about": [
        "Světadíly a oceány, pohoří, příkopy a středooceánské hřbety, sopky a zemětřesení, pohyb kontinentů. Minerály a horniny, dějiny Země od prahor po třetihory."
      ],
      "topics": [
        "z7/zemepis/svetadily-a-oceany",
        "z9/prirodopis/stavba-zeme",
        "z9/prirodopis/vnitrni-deje",
        "z9/prirodopis/vnejsi-deje",
        "z9/prirodopis/nerosty",
        "z9/prirodopis/horniny",
        "z9/prirodopis/ery-zeme"
      ]
    },
    {
      "id": "chemie-uchopena-clovekem",
      "title": "Chemie uchopená člověkem",
      "emoji": "⚗️",
      "month": "říjen",
      "about": [
        "Kvašení a alkohol, destilace, uhlí a ropa jako základ chemického průmyslu, paliva, plasty a léčiva. Uhlovodíky, alkoholy, kyseliny a estery."
      ],
      "topics": [
        "z9/chemie/alkany",
        "z9/chemie/nenasycene-uhlovodiky",
        "z9/chemie/derivaty-uhlovodiku",
        "z9/chemie/chemie-spolecnost"
      ]
    },
    {
      "id": "elektrina-prakticky",
      "title": "Elektřina prakticky",
      "emoji": "🔌",
      "month": "listopad",
      "about": [
        "Elektromagnetismus, obvody a telefon, motory a pohony, vlnění a rezonance."
      ],
      "topics": [
        "z9/fyzika/elektromagnetismus",
        "z9/fyzika/stridavy-proud",
        "z9/fyzika/transformator",
        "z9/fyzika/polovodice",
        "z9/fyzika/zvuk"
      ]
    },
    {
      "id": "umime-cesky",
      "title": "Umíme česky aneb nejen čárky ve větě",
      "emoji": "✍️",
      "month": "prosinec",
      "about": [
        "Větné členy, přívlastek volný a těsný, přístavek, vsuvka, věta jednočlenná a dvojčlenná, souvětí a jejich schémata. J. W. Goethe a F. Schiller."
      ],
      "topics": [
        "z9/cestina/vetne-cleny-opakovani",
        "z9/cestina/souveti-slozitejsi",
        "z9/cestina/interpunkce-prima-rec"
      ]
    },
    {
      "id": "lidstvo-v-1-polovine-20-stoleti",
      "title": "Lidstvo v 1. polovině 20. století",
      "emoji": "🎖️",
      "month": "leden",
      "about": [
        "První světová válka a její technika, vznik Československa a legie, meziválečná Evropa a krize, fašismus a nacismus, Mnichov a druhá světová válka."
      ],
      "topics": [
        "z9/dejepis/prvni-svetova-valka",
        "z9/dejepis/vznik-csr",
        "z9/dejepis/mezivalecne-obdobi",
        "z9/dejepis/prvni-republika",
        "z9/dejepis/druha-svetova-valka",
        "z9/dejepis/protektorat"
      ]
    },
    {
      "id": "biologie-cloveka",
      "title": "Biologie člověka a zvířecí říše",
      "emoji": "🧬",
      "month": "únor",
      "about": [
        "Kosti a jejich stavba, lidská kostra ve srovnání se zvířecí, chrup, smysly. Buňka, vývoj před narozením a po něm, dědičnost."
      ],
      "topics": [
        "z8/prirodopis/kostra-svaly",
        "z8/prirodopis/nervy-smysly",
        "z6/prirodopis/bunka",
        "z8/prirodopis/rozmnozovani-cloveka",
        "z9/prirodopis/genetika-uvod"
      ]
    },
    {
      "id": "krasa-v-krivkach-a-tvarech",
      "title": "Krása v křivkách a tvarech",
      "emoji": "🌐",
      "month": "březen",
      "about": [
        "Krychle, kvádr a hranol, kruh a kružnice, válec, koule, jehlan a kužel – vlastnosti, povrch a objem. Rozšiřující učivo: goniometrické funkce."
      ],
      "topics": [
        "z6/matematika/krychle-kvadr",
        "z7/matematika/hranoly",
        "z8/matematika/kruh-kruznice",
        "z8/matematika/valec",
        "z9/matematika/jehlan-kuzel",
        "z9/matematika/koule"
      ]
    },
    {
      "id": "umeni-a-krasa",
      "title": "Umění a krása",
      "emoji": "🖼️",
      "month": "duben",
      "about": [
        "Dějiny umění od pravěku po renesanci a dědictví velkých umělců."
      ],
      "topics": [
        "z7/dejepis/renesance-reformace"
      ]
    },
    {
      "id": "epocha-humoru",
      "title": "Epocha humoru",
      "emoji": "😄",
      "month": "květen",
      "about": [
        "Humor ve 20. století: Osvobozené divadlo a Jan Werich, Šimek a Grossmann, Divadlo Járy Cimrmana, Semafor. Vlastní humorné texty."
      ],
      "topics": [
        "z9/cestina/literatura-1-pol-20-stol",
        "z9/cestina/literatura-2-pol-20-stol"
      ]
    },
    {
      "id": "2-polovina-20-stoleti",
      "title": "Druhá polovina 20. století",
      "emoji": "🕊️",
      "month": "červen",
      "about": [
        "Poválečná Evropa a Československo, rok 1948, 1968 a normalizace, studená válka, konec kolonií a rok 1989."
      ],
      "topics": [
        "z9/dejepis/studena-valka",
        "z9/dejepis/komunismus-csr",
        "z9/dejepis/sametova-revoluce",
        "z9/dejepis/soucasny-svet"
      ]
    }
  ],
  "ongoing": [
    {
      "id": "matematika",
      "title": "Matematika",
      "emoji": "📐",
      "about": [
        "V cvičných hodinách povrch a objem, rovnice a výrazy, lomené výrazy, Pythagorova věta, finanční gramotnost, soustavy rovnic a funkce."
      ],
      "topics": [
        "z9/matematika/lomene-vyrazy",
        "z9/matematika/rovnice-neznama-ve-jmenovateli",
        "z9/matematika/soustavy-rovnic",
        "z9/matematika/linearni-funkce",
        "z9/matematika/financni-matematika",
        "z8/matematika/pythagorova-veta"
      ]
    },
    {
      "id": "clovek-a-spolecnost",
      "title": "Člověk a společnost",
      "emoji": "⚖️",
      "about": [
        "Demokracie a její kořeny, ústava a lidská práva, právo v každodenním životě, OSN, NATO a globální problémy."
      ],
      "topics": [
        "z8/obcanska/stat",
        "z8/obcanska/ustava",
        "z9/obcanska/pravni-rad",
        "z9/obcanska/obcanske-pravo",
        "z9/obcanska/mezinarodni-spoluprace",
        "z9/obcanska/globalni-problemy"
      ]
    },
    {
      "id": "cestina",
      "title": "Český jazyk",
      "emoji": "📗",
      "about": [
        "Slovní druhy a pravopis, slovotvorba, úvaha a výklad, literatura po roce 1948."
      ],
      "topics": [
        "z9/cestina/literarni-pojmy",
        "z9/cestina/prijimacky-pravopis"
      ]
    },
    {
      "id": "anglictina",
      "title": "Angličtina",
      "emoji": "🇬🇧",
      "about": [
        "Dospívání a emoce, multikulturní Amerika, umění a poezie, ochrana planety, práce a povolání. Podmínkové věty, předminulý čas, nepřímá řeč a trpný rod."
      ],
      "topics": [
        "z9/anglictina/zero-conditional",
        "z9/anglictina/first-conditional",
        "z9/anglictina/passive-present",
        "z9/anglictina/passive-past",
        "z9/anglictina/used-to"
      ]
    }
  ]
}
