{
  "$schema": "../../schema/approach-year.schema.json",
  "format": 1,
  "title": "1. třída",
  "epochs": [
    {
      "id": "svet-rovnych-a-oblych-car",
      "title": "Svět rovných a oblých čar",
      "emoji": "〰️",
      "month": "září",
      "about": [
        "Rovná a křivá čára, svislá i vodorovná, oblouky. Kreslením forem si ruka i oko zvykají na plynulý pohyb – je to příprava na písmena i čísla.",
        "K tomu: jsem školák, bezpečná cesta do školy, orientace v čase a roční období."
      ],
      "topics": [
        "z1/matematika/geometricke-tvary",
        "z1/prvouka/skola",
        "z1/prvouka/cesta-do-skoly",
        "z1/prvouka/rocni-obdobi"
      ]
    },
    {
      "id": "setkani-s-pismenky",
      "title": "Setkání s písmenky",
      "emoji": "🔤",
      "month": "říjen",
      "about": [
        "Básně a říkadla s důrazem na melodii a rytmus řeči. Hlásky D, R, Ř, K, T, B, M, L a jejich velká tiskací písmena, která vznikají z obrázků. Vyprávění pohádek a vlastních zážitků."
      ],
      "topics": [
        "z1/cestina/hlasky-a-pismena",
        "z1/cestina/kde-je-hlaska",
        "z1/prvouka/den-a-tyden"
      ]
    },
    {
      "id": "prvni-seznameni-s-cisly",
      "title": "První seznámení s čísly",
      "emoji": "🔢",
      "month": "listopad",
      "about": [
        "Římské a arabské číslice 1–12 a kvalita čísel: co je jedna, dvě, tři… Počítání s pohybem, číselná řada do 20.",
        "Základy všech čtyř početních operací při práci s přírodninami. Vychází se z celku."
      ],
      "topics": [
        "z1/matematika/cisla-do-5",
        "z1/matematika/cisla-do-10",
        "z1/matematika/rimske-cislice",
        "z1/matematika/porovnavani",
        "z1/matematika/cisla-do-20"
      ]
    },
    {
      "id": "samohlasky-a-prvni-psani",
      "title": "Samohlásky a první psaní",
      "emoji": "✏️",
      "month": "prosinec",
      "about": [
        "Samohlásky A, E, I, O, U, Y a souhlásky P, V, F, S, Š. Opisování krátkých slov, vlastní rýmy. Domov a rodina."
      ],
      "topics": [
        "z1/cestina/samohlasky-z1",
        "z1/cestina/slabiky-z1",
        "z1/prvouka/rodina"
      ]
    },
    {
      "id": "pocetni-operace",
      "title": "Početní operace",
      "emoji": "➕",
      "month": "leden",
      "about": [
        "Sčítání, odčítání a násobení vědoměji: znaménka a zápis. Sčítání a odčítání do 10 zpaměti, přechod přes desítku prakticky, násobkové řady 2 a 3, číselná řada do 40 tam i zpět."
      ],
      "topics": [
        "z1/matematika/scitani-do-10",
        "z1/matematika/odcitani-do-10",
        "z1/matematika/prechod-pres-desitku",
        "z2/matematika/nasobeni-uvod",
        "z2/matematika/nasobilka-2-3"
      ]
    },
    {
      "id": "slozitejsi-formy",
      "title": "Složitější formy",
      "emoji": "🌀",
      "month": "únor",
      "about": [
        "Čtverec, kruh, trojúhelník a elipsa jako rytmické tvary, jejich obměny a plynulý pohyb ruky. Naučné příběhy o životě."
      ],
      "topics": [
        "z1/matematika/geometricke-tvary"
      ]
    },
    {
      "id": "nasobkove-rady",
      "title": "Násobkové řady",
      "emoji": "✖️",
      "month": "březen",
      "about": [
        "Co je dělení a jak se zapisuje. Procvičování všech operací, počítání zpaměti do 10, násobkové řady 2, 3 a nově 4, čísla do 100."
      ],
      "topics": [
        "z1/matematika/scitani-odcitani-do-20",
        "z2/matematika/nasobilka-4-5",
        "z2/matematika/cisla-do-100"
      ]
    },
    {
      "id": "cela-abeceda",
      "title": "Celá abeceda",
      "emoji": "🅰️",
      "month": "duben",
      "about": [
        "Zbylá velká tiskací písmena. Psaní slov a vět, skládání jednoduchých slov z písmen, dramatizace vyprávění."
      ],
      "topics": [
        "z1/cestina/carka-a-krouzek",
        "z1/cestina/velka-a-mala-pismena",
        "z1/cestina/slova-ve-vete"
      ]
    },
    {
      "id": "hrave-pocitani",
      "title": "Hravé počítání",
      "emoji": "🎲",
      "month": "květen",
      "about": [
        "Sčítání, odčítání, násobení a dělení do 20 prakticky i zpaměti, orientace v číselné řadě do 100, násobková řada 5. Přírodní říše."
      ],
      "topics": [
        "z1/matematika/slovni-ulohy",
        "z2/matematika/opakovani-do-20",
        "z1/prvouka/zvirata",
        "z1/prvouka/ovoce-zelenina"
      ]
    },
    {
      "id": "prvni-texty",
      "title": "První texty",
      "emoji": "📜",
      "month": "červen",
      "about": [
        "Psaní souvislého textu – básničky a hádanky. Lidské tělo, péče o zdraví a zdravá výživa."
      ],
      "topics": [
        "z1/cestina/velke-pismeno-a-tecka",
        "z1/prvouka/moje-telo",
        "z1/prvouka/zdravi"
      ]
    }
  ],
  "ongoing": [
    {
      "id": "anglictina",
      "title": "Angličtina",
      "emoji": "🇬🇧",
      "about": [
        "Angličtina se v 1. třídě učí nápodobou: pozdravy, barvy, věci ve třídě, čísla do 10, říkanky a písničky. Doma se hodí slovíčka A1."
      ],
      "topics": [
        "z3/anglictina/pozdravy",
        "z3/anglictina/cisla-barvy"
      ]
    }
  ]
}
